ID,Title,Description,Acceptance,Test_Method,Tools,Dev_Status,Review1_Status,Regression_Status,Files,Dependencies,Notes
A1,Design system refresh + metadata,"Add Space Grotesk + Fraunces, define dark palette + tokens, update metadata + icons.","Fonts load correctly; palette applied; metadata + favicon updated.","npm run test:e2e",playwright:browser_*,DONE,DONE,DONE,"apps/web/src/app/layout.tsx | apps/web/src/app/globals.css | apps/web/public/* | apps/web/src/app/*",none,"E2E smoke covers title + icon presence; visual QA still recommended."
A2,Floating nav + Motion morph + SVG logo,"Implement floating nav with scroll morphing size/rounding and non-linear Motion animation; reuse new SVG logo.","Nav floats, morphs on scroll, and logo matches favicon; reduced-motion supported.","npm run test:e2e",playwright:browser_*,DONE,DONE,DONE,"apps/web/src/components/* | apps/web/src/app/page.tsx",A1,"E2E smoke covers nav + logo presence."
A3,3D integration (hero + gated sections),"Add three.js + react-three-fiber (+drei if needed); build lightweight scenes for hero and gated sections with perf guards.","3D scenes render in hero + gated sections without blocking main UI; fallback works.","npm run test:e2e",playwright:browser_*,DONE,DONE,DONE,"apps/web/src/components/* | apps/web/src/app/page.tsx | apps/web/package.json",A1,"E2E smoke verifies canvases render; use reduced-motion for perf guard."
A4,Layout + content recompose,"Recompose page sections for high-art aesthetic; integrate nav + 3D placements.","Responsive layout (mobile-first) looks polished on desktop; CTAs remain functional.","npm run test:e2e",playwright:browser_*,DONE,DONE,DONE,"apps/web/src/app/page.tsx | apps/web/src/app/globals.css",A1|A2|A3,"E2E smoke covers CTA visibility; responsive QA still recommended."
A5,Unit tests update/fix,"Add/adjust UI unit tests for new components and fix any broken tests.","npm test passes.","npm test",none,DONE,DONE,DONE,"apps/web/src/__tests__/* | apps/web/jest.config.cjs | apps/web/jest.setup.ts",A1|A2|A3|A4,"Added nav test + updated gating test; Jest setup mocks next/image + dynamic."
A6,E2E smoke + responsive sanity,"Run/update Playwright smoke and add basic responsive checks if needed.","npm run test:e2e passes or manual fallback steps documented.","npm run test:e2e",playwright:browser_*,DONE,DONE,DONE,"apps/web/tests/e2e/* | apps/web/playwright.config.ts",A4|A5,"Smoke test covers title, nav, CTAs, and 3D canvases."
